ID	Category	Pattern	Theme	Content	Color
1836	העצמה	ועם כל מספר	פראיות	ועם כל מספר, את חוזרת לטבע... ליער... לאדמה... לאינסטינקט הטהור.	#E1BEE7
1837	העצמה	ועם כל מספר	שמחה	ועם כל מספר, הלב מתרחב... עוד אור נכנס... עוד שמחה ממלאת את החלל.	#E1BEE7
1838	העצמה	ועם כל מספר	שמחה	ועם כל מספר, את מרגישה יותר אסירת תודה... יותר מאושרת מעצם היותך כאן.	#E1BEE7
1839	העצמה	ועם כל מספר	בטחון ומוגנות	ועם כל מספר, החומות סביבך מתחזקות... שומרות עלייך... מגינות מכל משמר.	#E1BEE7
1840	העצמה	ועם כל מספר	בטחון ומוגנות	ועם כל מספר, את שוקעת עמוק יותר לתוך הזרועות שמחזיקות אותך... בטוחה לגמרי.	#E1BEE7
1841	העצמה	מתג של ווליום	רגיעה	דמייני מתג של ווליום שמחובר למחשבות שלך... ואני מסובב אותו למטה... מחליש... עד לשקט מוחלט.	#E1BEE7
1842	העצמה	מתג של ווליום	רגיעה	זה מתג הרגיעה שלך... עכשיו הוא על 2... אני מסובב אותו ל-5... ל-8... והגוף פשוט נמס.	#E1BEE7
1843	העצמה	מתג של ווליום	עונג	דמייני מתג שמחובר לדגדגן שלך... ואני מסובב אותו לאט לאט למעלה... מגביר את הרטט... עוד ועוד.	#E1BEE7
1844	העצמה	מתג של ווליום	עונג	זה מתג העונג... ועם כל קליק של המתג, הגל הזה נהיה אינטנסיבי יותר... חזק יותר... עד הקצה.	#E1BEE7
1845	העצמה	מתג של ווליום	משחקיות	יש לך מתג של צבעים בראש... בואי נסובב אותו למקסימום ונראה איך העולם הופך לזוהר ובוהק.	#E1BEE7
1846	העצמה	מתג של ווליום	משחקיות	זה מתג הסקרנות... אני מגביר אותו, והעיניים שלך נפתחות לרווחה... הכל נראה מרתק פתאום.	#E1BEE7
1847	העצמה	מתג של ווליום	תשוקה	דמייני מתג ששולט על החום בגוף... אני מסובב אותו והטמפרטורה עולה... הלהט מתגבר... בוער.	#E1BEE7
1848	העצמה	מתג של ווליום	תשוקה	זה מתג המשיכה... כשאני מסובב אותו, את מרגישה איך את נמשכת אליי בכוח מגנטי בלתי נסבל.	#E1BEE7
1849	העצמה	מתג של ווליום	חופש	דמייני מתג שמחליש את כוח הכבידה... אני מסובב אותו ואת מתחילה לרחף... קלה... חופשייה.	#E1BEE7
1850	העצמה	מתג של ווליום	חופש	זה מתג הגבולות... ואני פשוט מכבה אותו. קליק. אין גבולות. הכל פתוח.	#E1BEE7
1851	העצמה	מתג של ווליום	שובבות	דמייני מתג של רצינות... ואנחנו מורידים אותו לאפס. אין רצינות. רק צחוק ושטויות.	#E1BEE7
1852	העצמה	מתג של ווליום	שובבות	זה מתג השובבות... בואי נרים אותו למקסימום ונראה איזה רעיונות מצחיקים עולים לך.	#E1BEE7
1853	העצמה	מתג של ווליום	סקסי	דמייני מתג שמגביר את הפרומונים שלך... אני מסובב אותו ואת הופכת לבלתי ניתנת לעמידה.	#E1BEE7
1854	העצמה	מתג של ווליום	סקסי	זה מתג הרגישות... אני מגביר אותו, ופתאום אפילו האוויר שנוגע בעור מרגיש כמו ליטוף ארוטי.	#E1BEE7
1855	העצמה	מתג של ווליום	פראיות	דמייני מתג שמעיר את החיה... אני מסובב אותו, ושומעים את הנשימה שלך משתנה... נהיית כבדה.	#E1BEE7
1856	העצמה	מתג של ווליום	פראיות	זה מתג השליטה... ואני מוריד אותו לאט לאט... עד שהאינסטינקט לוקח את הפיקוד המלא.	#E1BEE7
1857	העצמה	מתג של ווליום	שמחה	דמייני מתג שמגביר את האור בחדר... אבל מבפנים... והשמחה פשוט שוטפת הכל באור יקרות.	#E1BEE7
1858	העצמה	מתג של ווליום	שמחה	זה מתג האושר... כשאני נוגע בו, חיוך ענק מתפשט לך על הפנים בלי שליטה.	#E1BEE7
1859	העצמה	מתג של ווליום	בטחון ומוגנות	דמייני מתג שנועל את הדלתות לפחד... קליק. הכל נעול בחוץ. בפנים רק שקט וביטחון.	#E1BEE7
1860	העצמה	מתג של ווליום	בטחון ומוגנות	זה מתג ההגנה... אני מרים אותו למקסימום, ואת מרגישה עטופה בשדה אנרגיה בלתי חדיר.	#E1BEE7
1861	העצמה	וככל שהיד עולה	רגיעה	אני מרים את היד שלך, וככל שהיד עולה... העפעפיים שלך נהיים כבדים יותר ויותר.	#E1BEE7
1862	העצמה	וככל שהיד עולה	רגיעה	תדמייני שהיד שלך קשורה לבלון, וככל שהיד עולה... את שוקעת עמוק יותר לתוך המזרון.	#E1BEE7
1863	העצמה	וככל שהיד עולה	עונג	וככל שהיד עולה למעלה... רמת העונג בגוף שלך עולה יחד איתה... מטפסת לגבהים חדשים.	#E1BEE7
1864	העצמה	וככל שהיד עולה	עונג	ככל שהיד שלך מתרוממת באוויר... כך הגוף שלך מתמלא ביותר ויותר ויברציות של הנאה.	#E1BEE7
1865	העצמה	וככל שהיד עולה	משחקיות	וככל שהיד עולה... הדימוי בראש שלך נהיה גדול יותר, רחב יותר, פנורמי ועוטף.	#E1BEE7
1866	העצמה	וככל שהיד עולה	משחקיות	ככל שהיד מתרוממת מעצמה... כך העולם הדמיוני הזה הופך למציאות היחידה שלך כרגע.	#E1BEE7
1867	העצמה	וככל שהיד עולה	תשוקה	אני מרים את היד, וככל שהיד עולה... האש בבטן שלך מתלקחת ועולה יחד איתה ללב.	#E1BEE7
1868	העצמה	וככל שהיד עולה	תשוקה	וככל שהיד עולה... הרצון שלך לגעת, להרגיש, להתחבר, מתעצם עד שהוא בלתי נסבל.	#E1BEE7
1869	העצמה	וככל שהיד עולה	חופש	וככל שהיד עולה... את מרגישה קלה יותר, כאילו את ממריאה יחד איתה לשמיים הפתוחים.	#E1BEE7
1870	העצמה	וככל שהיד עולה	חופש	ככל שהיד מתרוממת... כך את משאירה למטה את כל מה שכבד ומיותר ומתנתקת מהקרקע.	#E1BEE7
1871	העצמה	וככל שהיד עולה	שובבות	וככל שהיד עולה... בועות של צחוק עולות איתה בגרון ורוצות להתפרץ החוצה.	#E1BEE7
1872	העצמה	וככל שהיד עולה	שובבות	ככל שהיד שלך צפה באוויר... כך מצב הרוח שלך מתרומם ונהיה קליל ומשעשע.	#E1BEE7
1873	העצמה	וככל שהיד עולה	סקסי	וככל שהיד עולה... את מרגישה איך הביטחון העצמי והמיני שלך זוקף קומה יחד איתה.	#E1BEE7
1874	העצמה	וככל שהיד עולה	סקסי	ככל שהיד מתרוממת... כך הגוף שלך נפתח, מזדקף, ומציג את עצמו לראווה בגאווה.	#E1BEE7
1875	העצמה	וככל שהיד עולה	פראיות	וככל שהיד עולה... האנרגיה הפראית מטפסת במעלה עמוד השדרה ומתכוננת לזינוק.	#E1BEE7
1876	העצמה	וככל שהיד עולה	פראיות	ככל שהיד שלך נמשכת למעלה... כך את משחררת את האחיזה בנורמות ונותנת לטבע להוביל.	#E1BEE7
1877	העצמה	וככל שהיד עולה	שמחה	וככל שהיד עולה... הלב שלך מתמלא ביותר ויותר הכרת תודה ושמחה פשוטה וטהורה.	#E1BEE7
1878	העצמה	וככל שהיד עולה	שמחה	ככל שהיד מתרוממת... כך את מרגישה שהרוח שלך מתרוממת איתה למקום של אושר עילאי.	#E1BEE7
1879	העצמה	וככל שהיד עולה	בטחון ומוגנות	וככל שהיד עולה... היא בונה סביבך חומה שקופה וחזקה של הגנה וביטחון.	#E1BEE7
1880	העצמה	וככל שהיד עולה	בטחון ומוגנות	ככל שהיד שלך יציבה באוויר... כך את מרגישה יציבה ובטוחה בתוך הגוף שלך.	#E1BEE7
1881	העצמה	יותר ויותר.. עוד ועוד..	רגיעה	והשקט הזה ממלא אותך... יותר ויותר... עוד ועוד... עד שאין מקום לשום דבר אחר מלבד רוגע.	#E1BEE7
1882	העצמה	יותר ויותר.. עוד ועוד..	רגיעה	את שוקעת... יותר ויותר עמוק... עוד ועוד למטה... אל המקום הכי שקט בנפש.	#E1BEE7
1883	העצמה	יותר ויותר.. עוד ועוד..	עונג	וזה נעים... יותר ויותר... עוד ועוד גלים של עונג שוטפים אותך ללא הפסקה.	#E1BEE7
1884	העצמה	יותר ויותר.. עוד ועוד..	עונג	התחושה הזו מתעצמת... יותר ויותר... עוד ועוד... ממלאת כל תא, כל עצב, כל נשימה.	#E1BEE7
1885	העצמה	יותר ויותר.. עוד ועוד..	משחקיות	והתמונה מתחדדת... יותר ויותר... עוד ועוד פרטים מתגלים... עוד ועוד צבעים בוהקים.	#E1BEE7
1886	העצמה	יותר ויותר.. עוד ועוד..	משחקיות	הסקרנות מושכת אותך... יותר ויותר פנימה... את רוצה לגלות עוד ועוד מהעולם הזה.	#E1BEE7
1887	העצמה	יותר ויותר.. עוד ועוד..	תשוקה	והלהט בוער... יותר ויותר... עוד ועוד חום... עוד ועוד תשוקה שאי אפשר לכבות.	#E1BEE7
1888	העצמה	יותר ויותר.. עוד ועוד..	תשוקה	את רוצה את זה... יותר ויותר... הצורך גדל עוד ועוד... עד שהוא הדבר היחיד שקיים.	#E1BEE7
1889	העצמה	יותר ויותר.. עוד ועוד..	חופש	המרחב נפתח... יותר ויותר... את עפה גבוה... עוד ועוד... משאירה את הכל מאחור.	#E1BEE7
1890	העצמה	יותר ויותר.. עוד ועוד..	חופש	את משתחררת... יותר ויותר... עוד ועוד כבלים נופלים... עוד ועוד אוויר נכנס לריאות.	#E1BEE7
1891	העצמה	יותר ויותר.. עוד ועוד..	שובבות	והחיוך גדל... יותר ויותר... זה מצחיק אותך... עוד ועוד... את לא יכולה להפסיק.	#E1BEE7
1892	העצמה	יותר ויותר.. עוד ועוד..	שובבות	השובבות משתלטת... יותר ויותר... את רוצה להשתעשע עוד ועוד... בלי גבולות.	#E1BEE7
1893	העצמה	יותר ויותר.. עוד ועוד..	סקסי	את מרגישה סקסית... יותר ויותר... הגוף שלך קורן... עוד ועוד... מושך... ממגנט.	#E1BEE7
1894	העצמה	יותר ויותר.. עוד ועוד..	סקסי	החושניות זורמת... יותר ויותר... עוד ועוד רגישות... עוד ועוד הזמנה למגע.	#E1BEE7
1895	העצמה	יותר ויותר.. עוד ועוד..	פראיות	הפראיות פורצת... יותר ויותר... עוד ועוד כוח... עוד ועוד עוצמה חייתי.	#E1BEE7
1896	העצמה	יותר ויותר.. עוד ועוד..	פראיות	השליטה נעלמת... יותר ויותר... האינסטינקט משתלט... עוד ועוד... עד הסוף.	#E1BEE7
1897	העצמה	יותר ויותר.. עוד ועוד..	שמחה	השמחה גואה... יותר ויותר... עוד ועוד אור... עוד ועוד אהבה שמציפה את הלב.	#E1BEE7
1898	העצמה	יותר ויותר.. עוד ועוד..	שמחה	את מאושרת... יותר ויותר... הלב מתרחב עוד ועוד... מכיל את כל הטוב הזה.	#E1BEE7
1899	העצמה	יותר ויותר.. עוד ועוד..	בטחון ומוגנות	את בטוחה... יותר ויותר... עוד ועוד שכבות של הגנה עוטפות אותך ברכות.	#E1BEE7
1900	העצמה	יותר ויותר.. עוד ועוד..	בטחון ומוגנות	את סומכת... יותר ויותר... מרפה עוד ועוד לתוך הידיים שמחזיקות אותך.	#E1BEE7
1901	העצמה	מרגע לרגע.. משניה לשניה	רגיעה	תרגישי איך עם כל נשימה ועם כל נשיפה את נרגעת עוד ועוד.. מרגע לרגע.. משניה לשניה.. הגוף נהיה כבד יותר.	#E1BEE7
1902	העצמה	מרגע לרגע.. משניה לשניה	רגיעה	השקט בראש שלך מעמיק... מרגע לרגע... משניה לשניה... המחשבות נעלמות והשלווה תופסת מקום.	#E1BEE7
1903	העצמה	מרגע לרגע.. משניה לשניה	עונג	העונג הזה מטפס... מרגע לרגע... משניה לשניה... הוא נהיה חד יותר, ברור יותר, מוחשי יותר.	#E1BEE7
1904	העצמה	מרגע לרגע.. משניה לשניה	עונג	תחושת ההנאה מתפשטת... מרגע לרגע... משניה לשניה... היא כובשת עוד אזור בגוף שלך.	#E1BEE7
1905	העצמה	מרגע לרגע.. משניה לשניה	משחקיות	העולם הדמיוני הזה נהיה אמיתי... מרגע לרגע... משניה לשניה... את ממש יכולה להריח ולשמוע אותו.	#E1BEE7
1906	העצמה	מרגע לרגע.. משניה לשניה	משחקיות	את נשאבת לתוך הסיפור... מרגע לרגע... משניה לשניה... שוכחת איפה את באמת נמצאת.	#E1BEE7
1907	העצמה	מרגע לרגע.. משניה לשניה	תשוקה	הדם זורם מהר יותר... מרגע לרגע... משניה לשניה... הגוף מתחמם והתשוקה גוברת.	#E1BEE7
1908	העצמה	מרגע לרגע.. משניה לשניה	תשוקה	הרעב הזה למגע מתחזק... מרגע לרגע... משניה לשניה... את חייבת להרגיש את זה עכשיו.	#E1BEE7
1909	העצמה	מרגע לרגע.. משניה לשניה	חופש	את מרגישה קלה יותר... מרגע לרגע... משניה לשניה... כוח המשיכה מאבד אחיזה עלייך.	#E1BEE7
1910	העצמה	מרגע לרגע.. משניה לשניה	חופש	האופק מתרחב... מרגע לרגע... משניה לשניה... את רואה אפשרויות שלא ראית קודם.	#E1BEE7
1911	העצמה	מרגע לרגע.. משניה לשניה	שובבות	המצב רוח עולה... מרגע לרגע... משניה לשניה... את מרגישה בועות של צחוק עולות בגרון.	#E1BEE7
1912	העצמה	מרגע לרגע.. משניה לשניה	שובבות	הקלילות משתלטת... מרגע לרגע... משניה לשניה... הכל נראה כמו משחק אחד גדול.	#E1BEE7
1913	העצמה	מרגע לרגע.. משניה לשניה	סקסי	המשיכה בינינו מתחזקת... מרגע לרגע... משניה לשניה... האוויר נהיה סמיך וטעון.	#E1BEE7
1914	העצמה	מרגע לרגע.. משניה לשניה	סקסי	הגוף שלך נהיה רגיש... מרגע לרגע... משניה לשניה... כל תנועה קטנה מורגשת בעוצמה אדירה.	#E1BEE7
1915	העצמה	מרגע לרגע.. משניה לשניה	פראיות	את מאבדת את הנימוס... מרגע לרגע... משניה לשניה... החיה שבפנים מתעוררת לחיים.	#E1BEE7
1916	העצמה	מרגע לרגע.. משניה לשניה	פראיות	הדחף לפעול גובר... מרגע לרגע... משניה לשניה... הגוף מתכונן לזינוק.	#E1BEE7
1917	העצמה	מרגע לרגע.. משניה לשניה	שמחה	הלב שלך נפתח... מרגע לרגע... משניה לשניה... את מרגישה מוצפת באהבה טהורה.	#E1BEE7
1918	העצמה	מרגע לרגע.. משניה לשניה	שמחה	החיוך שלך מתרחב... מרגע לרגע... משניה לשניה... האושר פשוט קורן ממך החוצה.	#E1BEE7
1919	העצמה	מרגע לרגע.. משניה לשניה	בטחון ומוגנות	את מרגישה יותר מוגנת... מרגע לרגע... משניה לשניה... המתח מתפוגג והביטחון ממלא את מקומו.	#E1BEE7
1920	העצמה	מרגע לרגע.. משניה לשניה	בטחון ומוגנות	האחיזה שלך מתרפה... מרגע לרגע... משניה לשניה... את יודעת שאת בידיים טובות.	#E1BEE7
1921	העצמה	אפילו .. יותר..	רגיעה	ואם חשבת שאת רגועה קודם, עכשיו את נכנסת למקום שקט אפילו יותר... עמוק יותר ממה שחשבת שאפשר.	#E1BEE7
1922	העצמה	אפילו .. יותר..	רגיעה	את מרפה את השרירים... ועכשיו, תרפי אותם אפילו יותר... עד שזה מרגיש כמו נוזל.	#E1BEE7
1923	העצמה	אפילו .. יותר..	עונג	זה מרגיש מדהים, נכון? ועכשיו, אני רוצה שתרגישי את זה אפילו יותר... בעוצמה שלא הכרת.	#E1BEE7
1924	העצמה	אפילו .. יותר..	עונג	תני לזרם הזה לעבור בך, ותני לו להיות אפילו יותר חזק... אפילו יותר מענג ממה שהוא עכשיו.	#E1BEE7
1925	העצמה	אפילו .. יותר..	משחקיות	הדמיון שלך עשיר, אבל עכשיו הוא הופך להיות אפילו יותר יצירתי... אפילו יותר צבעוני וחי.	#E1BEE7
1926	העצמה	אפילו .. יותר..	משחקיות	את סקרנית, ועכשיו את נהיית אפילו יותר סקרנית... את חייבת לגלות מה מסתתר שם.	#E1BEE7
1927	העצמה	אפילו .. יותר..	תשוקה	את רוצה את זה, ואת הולכת לרצות את זה אפילו יותר... עד שהגוף שלך יזוז מעצמו.	#E1BEE7
1928	העצמה	אפילו .. יותר..	תשוקה	הלהט הזה בוער, ועכשיו הוא בוער אפילו יותר... שורף כל התנגדות בדרך.	#E1BEE7
1929	העצמה	אפילו .. יותר..	חופש	את מרגישה חופשייה, אבל את יכולה להיות אפילו יותר חופשייה... לשחרר גם את המחשבה האחרונה.	#E1BEE7
1930	העצמה	אפילו .. יותר..	חופש	את עפה גבוה, ועכשיו את עולה אפילו יותר... מעל העננים, אל החלל הפתוח.	#E1BEE7
1931	העצמה	אפילו .. יותר..	שובבות	זה מצחיק, וזה הולך להיות אפילו יותר מצחיק... עד שתתגלגלי מצחוק.	#E1BEE7
1932	העצמה	אפילו .. יותר..	שובבות	את שובבה, ועכשיו את מעזה להיות אפילו יותר שובבה... למתוח את הגבול עוד קצת.	#E1BEE7
1933	העצמה	אפילו .. יותר..	סקסי	את נראית סקסית, ואת מרגישה עכשיו אפילו יותר סקסית... מלכה של פיתוי ויופי.	#E1BEE7
1934	העצמה	אפילו .. יותר..	סקסי	הגוף שלך רגיש, והוא הופך להיות אפילו יותר רגיש... כל רוח קלה מעבירה בך צמרמורת.	#E1BEE7
1935	העצמה	אפילו .. יותר..	פראיות	את פראית, ועכשיו את מתחברת למקום אפילו יותר קדום... אפילו יותר חייתי ושורשי.	#E1BEE7
1936	העצמה	אפילו .. יותר..	פראיות	האינסטינקט חזק, והוא נהיה אפילו יותר חד... מוביל אותך בדיוק לאן שאת צריכה.	#E1BEE7
1937	העצמה	אפילו .. יותר..	שמחה	את שמחה, ועכשיו השמחה הזו נהיית אפילו יותר גדולה... ממלאת את החדר כולו.	#E1BEE7
1938	העצמה	אפילו .. יותר..	שמחה	הלב מלא, והוא מתמלא אפילו יותר... עד שהוא עולה על גדותיו מרוב אושר.	#E1BEE7
1939	העצמה	אפילו .. יותר..	בטחון ומוגנות	את בטוחה, ועכשיו את מרגישה אפילו יותר בטוחה... כמו תינוק ברחם.	#E1BEE7
1940	העצמה	אפילו .. יותר..	בטחון ומוגנות	המרחב הזה מוגן, והוא נהיה אפילו יותר יציב ועוטף סביבך.	#E1BEE7
1941	פנייה לתת מודע	הנחיה לתת המודע	רגיעה	אני הולך לתת עכשיו הנחיה לתת המודע שלך לנתק את המתח מהשרירים, אחד אחרי השני, עד לרפיון מוחלט.	#80DEEA
1942	פנייה לתת מודע	הנחיה לתת המודע	רגיעה	התת מודע שלך מקבל עכשיו הנחיה להאט את קצב הלב ולהכניס אותך למצב של שינה עמוקה ומרפאת.	#80DEEA
1943	פנייה לתת מודע	הנחיה לתת המודע	עונג	אני נותן הנחיה לתת המודע שלך לפתוח את ערוצי העונג בגוף, כך שכל מגע ירגיש כמו זרם חשמלי נעים.	#80DEEA
1944	פנייה לתת מודע	הנחיה לתת המודע	עונג	התת מודע שלך מקבל אישור להגביר את רגישות העור פי עשרה, ולהפוך כל תחושה לחגיגה של חושים.	#80DEEA
1945	פנייה לתת מודע	הנחיה לתת המודע	משחקיות	אני מנחה את התת מודע שלך להעלות זיכרון ילדות של משחק וצחוק, ולהביא את התחושה הזו לכאן ועכשיו.	#80DEEA
1946	פנייה לתת מודע	הנחיה לתת המודע	משחקיות	התת מודע שלך מקבל הנחיה להפוך את המציאות למגרש משחקים צבעוני ומרתק עבורך.	#80DEEA
1947	פנייה לתת מודע	הנחיה לתת המודע	תשוקה	אני נותן הנחיה לתת המודע שלך להבעיר את האש הפנימית, ולהזרים חום ותשוקה לכל איבר בגוף.	#80DEEA
1948	פנייה לתת מודע	הנחיה לתת המודע	תשוקה	התת מודע שלך מקבל הוראה למקד את כל האנרגיה המינית שלך ברגע הזה, בעוצמה שלא הכרת.	#80DEEA
1949	פנייה לתת מודע	הנחיה לתת המודע	חופש	אני מנחה את תת המודע שלך לשבור את כל המחסומים הדמיוניים, ולאפשר לך לעוף לכל מקום שתרצי.	#80DEEA
1950	פנייה לתת מודע	הנחיה לתת המודע	חופש	התת מודע שלך מקבל הנחיה לשחרר כל אחיזה, ולתת לנשמה שלך להרגיש חסרת משקל וגבולות.	#80DEEA
1951	פנייה לתת מודע	הנחיה לתת המודע	שובבות	אני נותן הנחיה לתת המודע שלך להעלות חיוך שובב על שפתייך, ללא שום סיבה הגיונית.	#80DEEA
1952	פנייה לתת מודע	הנחיה לתת המודע	שובבות	התת מודע שלך מקבל אישור לעשות משהו קצת אסור ומשעשע, רק כדי לראות מה יקרה.	#80DEEA
1953	פנייה לתת מודע	הנחיה לתת המודע	סקסי	אני מנחה את תת המודע שלך לשדר החוצה גלים של מיניות ומשיכה מגנטית שאי אפשר לעמוד בפניה.	#80DEEA
1954	פנייה לתת מודע	הנחיה לתת המודע	סקסי	התת מודע שלך מקבל הנחיה להפוך את הגוף שלך לכלי נגינה שמגיב בצלילים של עונג לכל מגע.	#80DEEA
1955	פנייה לתת מודע	הנחיה לתת המודע	פראיות	אני נותן הנחיה לתת המודע שלך לשחרר את החיה הפראית שכלואה בפנים, ולתת לה לצאת החוצה.	#80DEEA
1956	פנייה לתת מודע	הנחיה לתת המודע	פראיות	התת מודע שלך מקבל הוראה לפעול מתוך אינסטינקט טהור, פראי ונטול עכבות תרבותיות.	#80DEEA
1957	פנייה לתת מודע	הנחיה לתת המודע	שמחה	אני מנחה את תת המודע שלך להציף את הגוף באנדורפינים של אושר, ולמלא אותך באור זוהר.	#80DEEA
1958	פנייה לתת מודע	הנחיה לתת המודע	שמחה	התת מודע שלך מקבל הנחיה לצבוע את העולם בצבעים עזים של שמחה ואופטימיות חסרת תקנה.	#80DEEA
1959	פנייה לתת מודע	הנחיה לתת המודע	בטחון ומוגנות	אני נותן הנחיה לתת המודע שלך לבנות סביבך בועת מגן שקופה וחזקה, ששום דבר לא יכול לחדור.	#80DEEA
1960	פנייה לתת מודע	הנחיה לתת המודע	בטחון ומוגנות	התת מודע שלך מקבל הנחיה לעגון אותך בקרקע יציבה ובטוחה, שמאפשרת לך לנוח באמת.	#80DEEA
