ID	Category	Pattern	Theme	Content	Color
1281	השוואה מורכבת	מה שמראה ש...	רגיעה	והנשימה שלך השתנתה... מה שמראה שהגוף כבר מתחיל להירגע... והפנים רכות... מה שמראה שהרוגע כבר כאן... והעיניים סגורות בנחת... מה שמראה שאת כבר שוקעת עמוק	#FFAB91
1282	השוואה מורכבת	מה שמראה ש...	רגיעה	והידיים כבדות... מה שמראה שהרפיון מתחיל... והגוף שקט... מה שמראה שהשקט מתעמק... והתנועות איטיות... מה שמראה שאת נכנסת לשלווה	#FFAB91
1283	השוואה מורכבת	מה שמראה ש...	עונג	והעור מגיב... מה שמראה שהגוף מתעורר להנאה... והנשימה עמוקה... מה שמראה שהעונג גדל... והפנים מתוקות... מה שמראה שאת נהנית	#FFAB91
1284	השוואה מורכבת	מה שמראה ש...	עונג	והגוף נע קצת... מה שמראה שהתחושות חזקות... והעיניים זזות... מה שמראה שההנאה שם... והחיוך עדין... מה שמראה שזה נעים מאוד	#FFAB91
1285	השוואה מורכבת	מה שמראה ש...	משחקיות	והעיניים זזות מאחורי העפעפיים... מה שמראה שהדימוי חי... והחיוך עולה... מה שמראה שהסקרנות גוברת... והראש נד קצת... מה שמראה שאת בתוך המסע	#FFAB91
1286	השוואה מורכבת	מה שמראה ש...	משחקיות	והנשימה משתנה... מה שמראה שמשהו מעניין קורה... והפנים משתנות... מה שמראה שהדמיון משחק... והמעורבות גדלה... מה שמראה שזה מרתק	#FFAB91
1287	השוואה מורכבת	מה שמראה ש...	תשוקה	והלב דופק מהר... מה שמראה שהחשק עולה... והגוף חם... מה שמראה שהרצון גובר... והשפתיים נפתחות... מה שמראה שהלהט מתלקח	#FFAB91
1288	השוואה מורכבת	מה שמראה ש...	תשוקה	והנשימה עמוקה ומהירה... מה שמראה שהתשוקה חזקה... והעיניים כהות... מה שמראה שהדחף שולט... והגוף מתוח... מה שמראה שאת רוצה מאוד	#FFAB91
1289	השוואה מורכבת	מה שמראה ש...	חופש	והכתפיים נפתחות... מה שמראה שהחזה מתרחב... והנשימה חופשית... מה שמראה שהכבלים נופלים... והגוף קל... מה שמראה שאת מתחילה לעוף	#FFAB91
1290	השוואה מורכבת	מה שמראה ש...	חופש	והראש מורם... מה שמראה שהכבדות הלכה... והידיים חופשיות... מה שמראה שהמגבלות נעלמו... והחיוך רחב... מה שמראה שאת משוחררת	#FFAB91
1291	השוואה מורכבת	מה שמראה ש...	שובבות	והשפתיים רועדות בחיוך... מה שמראה שהשובבות מתעוררת... והעיניים מבריקות... מה שמראה שהכיף מתחיל... והצחוק קרוב... מה שמראה שאת נהנית	#FFAB91
1292	השוואה מורכבת	מה שמראה ש...	שובבות	והגוף מתנועע... מה שמראה שהדגדוג עובד... והחיוך לא נעלם... מה שמראה שהקלילות שם... והנשימה קלילה... מה שמראה שאת שמחה	#FFAB91
1293	השוואה מורכבת	מה שמראה ש...	סקסי	והעור מזדקף... מה שמראה שהרגישות עולה... והנשימה שונה... מה שמראה שהחושניות מתעוררת... והגוף נוגע לעצמו... מה שמראה שאת חיה	#FFAB91
1294	השוואה מורכבת	מה שמראה ש...	סקסי	והשפתיים לחות... מה שמראה שהגוף מזמין... והעיניים חצי סגורות... מה שמראה שהנשיות פורצת... והתנוחה משתנה... מה שמראה שאת מגרה	#FFAB91
1295	השוואה מורכבת	מה שמראה ש...	פראיות	והנשימה פרימיטיבית... מה שמראה שהאינסטינקטים מדברים... והשרירים מתוחים... מה שמראה שהגוף מוכן... והעיניים חדות... מה שמראה שהחיה יצאה	#FFAB91
1296	השוואה מורכבת	מה שמראה ש...	פראיות	והתנועות מהירות... מה שמראה שהדחף שולט... והשליטה אבודה... מה שמראה שהפראיות תפסה... והכוח בא... מה שמראה שאת חופשיה לגמרי	#FFAB91
1297	השוואה מורכבת	מה שמראה ש...	שמחה	והחזה פתוח... מה שמראה שהלב נפתח... והפנים מאירות... מה שמראה שהשמחה פורצת... והחיוך רחב... מה שמראה שאת מאושרת	#FFAB91
1298	השוואה מורכבת	מה שמראה ש...	שמחה	והעיניים זורחות... מה שמראה שהאושר עמוק... והגוף קפוץ... מה שמראה שהאנרגיה חיובית... והכל זורם... מה שמראה שאת מלאה בחיים	#FFAB91
1299	השוואה מורכבת	מה שמראה ש...	בטחון ומוגנות	והגוף רפוי לגמרי... מה שמראה שאת מרגישה בטוחה... והנשימה איטית... מה שמראה שהביטחון עמוק... והפנים שלוות... מה שמראה שאת מוגנת	#FFAB91
1300	השוואה מורכבת	מה שמראה ש...	בטחון ומוגנות	והמתח נעלם... מה שמראה שאת סומכת... והגוף כבד... מה שמראה שההגנה אמיתית... והשקט מלא... מה שמראה שאת יכולה להרפות	#FFAB91
1301	השוואה מורכבת	והמשמעות של זה	רגיעה	והנשימה עמוקה... והמשמעות של זה היא שהגוף מתחיל להירגע... והרוגע מתפשט... והמשמעות של זה היא שאת שוקעת... והשקט גדל... והמשמעות של זה היא שאת בדרך לשלווה מוחלטת	#FFAB91
1302	השוואה מורכבת	והמשמעות של זה	רגיעה	והפנים רכות... והמשמעות של זה היא שהמתח הולך... והגוף כבד... והמשמעות של זה היא שהרפיון מתעמק... והעיניים סגורות... והמשמעות של זה היא שאת מוכנה לשקט	#FFAB91
1303	השוואה מורכבת	והמשמעות של זה	עונג	והעור מגיב... והמשמעות של זה היא שהגוף מתעורר להנאה... והתחושות גדלות... והמשמעות של זה היא שהעונג לוקח מקום... והנשימה משתנה... והמשמעות של זה היא שאת נהנית	#FFAB91
1304	השוואה מורכבת	והמשמעות של זה	עונג	והגוף רוצה עוד... והמשמעות של זה היא שההנאה אמיתית... והתחושות מתעצמות... והמשמעות של זה היא שהעונג גובר... והחיוך עולה... והמשמעות של זה היא שזה טוב	#FFAB91
1305	השוואה מורכבת	והמשמעות של זה	משחקיות	והעיניים זזות... והמשמעות של זה היא שהדימוי חי... והסקרנות גדלה... והמשמעות של זה היא שהמסע מרתק... והחיוך שם... והמשמעות של זה היא שזה כיפי	#FFAB91
1306	השוואה מורכבת	והמשמעות של זה	משחקיות	והדמיון משחק... והמשמעות של זה היא שהיצירתיות זורמת... והפתעות מגיעות... והמשמעות של זה היא שזה מעניין... והמעורבות גדלה... והמשמעות של זה היא שאת רוצה עוד	#FFAB91
1307	השוואה מורכבת	והמשמעות של זה	תשוקה	והלב דופק מהר... והמשמעות של זה היא שהחשק עולה... והגוף חם... והמשמעות של זה היא שהרצון גובר... והנשימה עמוקה... והמשמעות של זה היא שהלהט בוער	#FFAB91
1308	השוואה מורכבת	והמשמעות של זה	תשוקה	והעיניים כהות... והמשמעות של זה היא שהתשוקה חזקה... והגוף מתוח... והמשמעות של זה היא שהדחף שולט... והשפתיים פתוחות... והמשמעות של זה היא שאת רוצה מאוד	#FFAB91
1309	השוואה מורכבת	והמשמעות של זה	חופש	והכתפיים נפתחות... והמשמעות של זה היא שהחזה מתרחב... והנשימה חופשית... והמשמעות של זה היא שהכבלים נופלים... והגוף קל... והמשמעות של זה היא שאת עפה	#FFAB91
1310	השוואה מורכבת	והמשמעות של זה	חופש	והמחסומים נעלמים... והמשמעות של זה היא שהמרחב נפתח... והפחדים הולכים... והמשמעות של זה היא שהחופש בא... והקלילות שם... והמשמעות של זה היא שאת משוחררת	#FFAB91
1311	השוואה מורכבת	והמשמעות של זה	שובבות	והשפתיים מתעקמות... והמשמעות של זה היא שהשובבות מתעוררת... והעיניים מבריקות... והמשמעות של זה היא שהכיף מתחיל... והצחוק קרוב... והמשמעות של זה היא שאת נהנית	#FFAB91
1312	השוואה מורכבת	והמשמעות של זה	שובבות	והגוף נע... והמשמעות של זה היא שהדגדוג עובד... והחיוך גדל... והמשמעות של זה היא שהקלילות שם... והנשימה משתנה... והמשמעות של זה היא שאת שמחה	#FFAB91
1313	השוואה מורכבת	והמשמעות של זה	סקסי	והעור מזדקף... והמשמעות של זה היא שהרגישות עולה... והנשימה עמוקה... והמשמעות של זה היא שהחושניות מתעוררת... והגוף דורש... והמשמעות של זה היא שאת חיה	#FFAB91
1314	השוואה מורכבת	והמשמעות של זה	סקסי	והשפתיים נפתחות... והמשמעות של זה היא שהגוף מזמין... והעיניים חצי סגורות... והמשמעות של זה היא שהנשיות פורצת... והחום עולה... והמשמעות של זה היא שאת מגרה	#FFAB91
1315	השוואה מורכבת	והמשמעות של זה	פראיות	והנשימה פרימיטיבית... והמשמעות של זה היא שהאינסטינקטים מדברים... והשרירים מתוחים... והמשמעות של זה היא שהגוף מוכן... והשליטה חומקת... והמשמעות של זה היא שהחיה יוצאת	#FFAB91
1316	השוואה מורכבת	והמשמעות של זה	פראיות	והעיניים פראיות... והמשמעות של זה היא שהדחף שולט... והתנועות מהירות... והמשמעות של זה היא שהפראיות תפסה... והכוח גדל... והמשמעות של זה היא שאת חופשיה	#FFAB91
1317	השוואה מורכבת	והמשמעות של זה	שמחה	והחזה נפתח... והמשמעות של זה היא שהלב נפתח... והפנים מאירות... והמשמעות של זה היא שהשמחה פורצת... והחיוך אמיתי... והמשמעות של זה היא שאת מאושרת	#FFAB91
1318	השוואה מורכבת	והמשמעות של זה	שמחה	והעיניים זורחות... והמשמעות של זה היא שהאושר עמוק... והאנרגיה גבוהה... והמשמעות של זה היא שהחיים זורמים... והכל זוהר... והמשמעות של זה היא שאת מלאה בשמחה	#FFAB91
1319	השוואה מורכבת	והמשמעות של זה	בטחון ומוגנות	והגוף רפוי... והמשמעות של זה היא שאת מרגישה בטוחה... והנשימה איטית... והמשמעות של זה היא שהביטחון עמוק... והפנים שלוות... והמשמעות של זה היא שאת מוגנת	#FFAB91
1320	השוואה מורכבת	והמשמעות של זה	בטחון ומוגנות	והמתח נעלם... והמשמעות של זה היא שאת סומכת... והגוף כבד... והמשמעות של זה היא שההגנה אמיתית... והשקט מלא... והמשמעות של זה היא שאת יכולה להרפות	#FFAB91
1321	השוואה מורכבת	_____זה כמו____	רגיעה	והדרך שבה את שוקעת עכשיו... זה כמו לצלול למים חמים... והרפיון שמתפשט... זה כמו קרח שנמס... והשקט שנכנס... זה כמו ערפל רך שמקיף אותך	#FFAB91
1322	השוואה מורכבת	_____זה כמו____	רגיעה	והתחושה של להרפות... זה כמו לשים עומס כבד... והדרך שבה הנשימה זורמת... זה כמו גלים רגועים על חוף... והשלווה הזו... זה כמו לשכב על ענן	#FFAB91
1323	השוואה מורכבת	_____זה כמו____	עונג	והעונג שזורם בך... זה כמו דבש חם שמתפשט... והתחושות שגדלות... זה כמו פרחים שפורחים אחד אחד... וההנאה הזו... זה כמו שמש חמה על העור	#FFAB91
1324	השוואה מורכבת	_____זה כמו____	עונג	והדרך שבה הגוף מגיב... זה כמו מיתר שרוטט... והעוצמה של התחושה... זה כמו גל שעולה... והתענוג הזה... זה כמו מוזיקה שזורמת דרכך	#FFAB91
1325	השוואה מורכבת	_____זה כמו____	משחקיות	והדימוי שמתגבש... זה כמו ציור שמתגלה... והסקרנות שלך... זה כמו ילד בחנות צעצועים... והמסע הזה... זה כמו הרפתקה קסומה	#FFAB91
1326	השוואה מורכבת	_____זה כמו____	משחקיות	והדרך שבה הדמיון משחק... זה כמו צבעים שרוקדים... ההפתעות שמגיעות... זה כמו מתנות שנפתחות... והכיף הזה... זה כמו שמחת ילדות	#FFAB91
1327	השוואה מורכבת	_____זה כמו____	תשוקה	והחשק שעולה בך... זה כמו אש שמתחילה קטנה... והלהט שגדל... זה כמו להבה שמתפשטת... והרצון הזה... זה כמו רעב עמוק שדורש למלא אותו	#FFAB91
1328	השוואה מורכבת	_____זה כמו____	תשוקה	והדרך שבה הגוף מתעורר... זה כמו וולקן שמתחיל לרעום... והתשוקה שבוערת... זה כמו שריפה שאי אפשר לכבות... והדחף הזה... זה כמו גל ענק שסוחף	#FFAB91
1329	השוואה מורכבת	_____זה כמו____	חופש	והדרך שבה את משתחררת... זה כמו ציפור שיוצאת מכלוב... והקלילות שמגיעה... זה כמו נוצה באוויר... והחופש הזה... זה כמו שמיים פתוחים לרווחה	#FFAB91
1330	השוואה מורכבת	_____זה כמו____	חופש	והתחושה של להיות חופשיה... זה כמו להפשיט שריון כבד... והמרחב שנפתח... זה כמו אופק אינסופי... והשחרור הזה... זה כמו לעוף מעל העולם	#FFAB91
1331	השוואה מורכבת	_____זה כמו____	שובבות	והחיוך שעולה... זה כמו שמש שמציצה מעננים... והדגדוג שמתפשט... זה כמו נוצה שרצה על העור... והכיף הזה... זה כמו בועות שעולות בשמפניה	#FFAB91
1332	השוואה מורכבת	_____זה כמו____	שובבות	והדרך שבה את משחקת... זה כמו ילדה בגינה... והקלילות... זה כמו בלון שעף... והשמחה הזו... זה כמו צחוק שלא נגמר	#FFAB91
1333	השוואה מורכבת	_____זה כמו____	סקסי	והדרך שבה העור מגיב... זה כמו חשמל רך... והחושניות שזורמת... זה כמו משי על הגוף... והעוררות הזו... זה כמו אש תת-קרקעית	#FFAB91
1334	השוואה מורכבת	_____זה כמו____	סקסי	והתחושה של כוח נשי... זה כמו אלת עתיקה... והחושניות המלאה... זה כמו ריקוד פראי... והמגנטיות הזו... זה כמו כוח שמושך הכל אליו	#FFAB91
1335	השוואה מורכבת	_____זה כמו____	פראיות	והדרך שבה הגוף פועל... זה כמו חיה ביער... והאינסטינקטים... זה כמו חוש שישי טהור... והפראיות הזו... זה כמו סערה שלא ניתן לעצור	#FFAB91
1336	השוואה מורכבת	_____זה כמו____	פראיות	והתחושה של לאבד שליטה... זה כמו נפילה חופשית... והדחף הפרימיטיבי... זה כמו שאגת אריה... והחופש הזה... זה כמו לרוץ פראי במדבר	#FFAB91
1337	השוואה מורכבת	_____זה כמו____	שמחה	והאור שבלב... זה כמו שמש זורחת... והשמחה שפורצת... זה כמו אביב שמגיע... והאושר הזה... זה כמו מנגינה שלא נגמרת	#FFAB91
1338	השוואה מורכבת	_____זה כמו____	שמחה	והדרך שבה הלב נפתח... זה כמו פרח שפורח... והזוהר שבעיניים... זה כמו כוכבים בלילה... והחיים הזה... זה כמו מחול של אור	#FFAB91
1339	השוואה מורכבת	_____זה כמו____	בטחון ומוגנות	והתחושה של ביטחון... זה כמו להיות בחיבוק חזק... והרפיון שבא... זה כמו לשקוע במיטה רכה... והשלווה הזו... זה כמו לדעת שהכל יהיה בסדר	#FFAB91
1340	השוואה מורכבת	_____זה כמו____	בטחון ומוגנות	והדרך שבה את סומכת... זה כמו ילדה בזרועות אבא... וההגנה שמסביב... זה כמו מגן זהוב... והשקט הזה... זה כמו נמל בטוח בסערה	#FFAB91
1341	השוואה מורכבת	בכל פעם ש ...את....	רגיעה	בכל פעם שאת נושמת עמוק... את שוקעת עמוק יותר... בכל פעם שאת מקשיבה לקול שלי... את נרגעת יותר... בכל פעם שאת מרפה... השקט גדל	#FFAB91
1342	השוואה מורכבת	בכל פעם ש ...את....	רגיעה	בכל פעם שהזמן עובר... את יותר שלווה... בכל פעם שהגוף משתחרר... הרוגע מתעמק... בכל פעם שאת שומעת את המילים האלה... את יורדת עמוק יותר למטה	#FFAB91
1343	השוואה מורכבת	בכל פעם ש ...את....	עונג	בכל פעם שאת מרגישה תחושה נעימה... היא גדלה... בכל פעם שאת נותנת לה... היא מתעצמת... בכל פעם שאת פותחת... העונג זורם חזק יותר	#FFAB91
1344	השוואה מורכבת	בכל פעם ש ...את....	עונג	בכל פעם שהגוף מגיב... ההנאה חזקה יותר... בכל פעם שאת מרשה... התחושות גוברות... בכל פעם שאת נהנית... את רוצה עוד ועוד	#FFAB91
1345	השוואה מורכבת	בכל פעם ש ...את....	משחקיות	בכל פעם שהדימוי משתנה... את יותר מעורבת... בכל פעם שאת סקרנית... המסע מעניין יותר... בכל פעם שאת מגלה... הכיף גדל	#FFAB91
1346	השוואה מורכבת	בכל פעם ש ...את....	משחקיות	בכל פעם שהדמיון משחק... היצירתיות זורמת... בכל פעם שאת לא שופטת... ההפתעות מגיעות... בכל פעם שאת נהנית... זה כיפי יותר	#FFAB91
1347	השוואה מורכבת	בכל פעם ש ...את....	תשוקה	בכל פעם שהחשק עולה... את רוצה יותר... בכל פעם שהגוף מתעורר... הרצון גובר... בכל פעם שאת מרגישה את זה... הלהט בוער חזק יותר	#FFAB91
1348	השוואה מורכבת	בכל פעם ש ...את....	תשוקה	בכל פעם שהלב דופק... התשוקה מתעצמת... בכל פעם שאת לא מתאפקת... הדחף חזק יותר... בכל פעם שאת נותנת לו... הוא לוקח אותך יותר	#FFAB91
1349	השוואה מורכבת	בכל פעם ש ...את....	חופש	בכל פעם שאת משחררת משהו... את קלה יותר... בכל פעם שכבל נופל... המרחב גדל... בכל פעם שאת נושמת חופשי... את עפה גבוה יותר	#FFAB91
1350	השוואה מורכבת	בכל פעם ש ...את....	חופש	בכל פעם שאת נותנת לעצמך רשות... החופש מתרחב... בכל פעם שהפחדים הולכים... הכנפיים חזקות יותר... בכל פעם שאת משתחררת... את יותר חופשיה	#FFAB91
1351	השוואה מורכבת	בכל פעם ש ...את....	שובבות	בכל פעם שאת מחייכת... השובבות עולה... בכל פעם שאת משחקת... הכיף גדל... בכל פעם שאת קלילה... החיים יפים יותר	#FFAB91
1352	השוואה מורכבת	בכל פעם ש ...את....	שובבות	בכל פעם שהדגדוג מתחיל... את צוחקת יותר... בכל פעם שאת לא רצינית... הקלילות גדלה... בכל פעם שאת נהנית... הצחוק חזק יותר	#FFAB91
1353	השוואה מורכבת	בכל פעם ש ...את....	סקסי	בכל פעם שהעור מתעורר... הרגישות עולה... בכל פעם שהגוף מגורה... החושניות גדלה... בכל פעם שאת מודעת... את חיה יותר	#FFAB91
1354	השוואה מורכבת	בכל פעם ש ...את....	סקסי	בכל פעם שהנשיות פורצת... הכוח גדל... בכל פעם שאת לא מתביישת... החושניות חופשית יותר... בכל פעם שאת מגרה... את יותר מגנטית	#FFAB91
1355	השוואה מורכבת	בכל פעם ש ...את....	פראיות	בכל פעם שהשליטה חומקת... הפראיות עולה... בכל פעם שהאינסטינקטים מדברים... הגוף פועל חזק יותר... בכל פעם שאת מרפה... החיה חופשית יותר	#FFAB91
1356	השוואה מורכבת	בכל פעם ש ...את....	פראיות	בכל פעם שהדחף גובר... את פחות שולטת... בכל פעם שאת נותנת... הפראיות תופסת יותר... בכל פעם שזה קורה... את יותר אמיתית	#FFAB91
1357	השוואה מורכבת	בכל פעם ש ...את....	שמחה	בכל פעם שהלב נפתח... השמחה גדלה... בכל פעם שאת מרשה לאושר... הוא זורח חזק יותר... בכל פעם שאת מחייכת... האור מתפשט	#FFAB91
1358	השוואה מורכבת	בכל פעם ש ...את....	שמחה	בכל פעם שהשמחה פורצת... את מאושרת יותר... בכל פעם שאת נותנת... האושר ממלא יותר... בכל פעם שאת זורחת... הכל יפה יותר	#FFAB91
1359	השוואה מורכבת	בכל פעם ש ...את....	בטחון ומוגנות	בכל פעם שאת מרגישה בטוחה... את מרפה יותר... בכל פעם שאת סומכת... הביטחון עמוק יותר... בכל פעם שאת יודעת שאת מוגנת... את שלווה יותר	#FFAB91
1360	השוואה מורכבת	בכל פעם ש ...את....	בטחון ומוגנות	בכל פעם שהגוף משתחרר... ההגנה חזקה יותר... בכל פעם שהמתח הולך... הביטחון גדל... בכל פעם שאת נרגעת... את יותר בטוחה	#FFAB91
1361	השוואה מורכבת	כשאת .....את....	רגיעה	כשאת נושמת עמוק... את מרגיעה את הגוף... כשאת מקשיבה... את שוקעת פנימה... כשאת מרפה... את נכנסת לשקט	#FFAB91
1362	השוואה מורכבת	כשאת .....את....	רגיעה	כשאת סוגרת עיניים... את פותחת עולם פנימי... כשאת נרגעת... את מגלה שלווה... כשאת שוקעת... את מוצאת שקט מוחלט	#FFAB91
1363	השוואה מורכבת	כשאת .....את....	עונג	כשאת מרגישה... את מגבירה... כשאת פותחת... את מקבלת... כשאת נהנית... את רוצה עוד	#FFAB91
1364	השוואה מורכבת	כשאת .....את....	עונג	כשאת מודעת לתחושות... את מחזקת אותן... כשאת נותנת להן מקום... את ממלאת בהן... כשאת מרשה... את חווה מלא	#FFAB91
1365	השוואה מורכבת	כשאת .....את....	משחקיות	כשאת מדמיינת... את יוצרת... כשאת משחקת... את חיה... כשאת סקרנית... את מגלה	#FFAB91
1366	השוואה מורכבת	כשאת .....את....	משחקיות	כשאת לא שופטת... את חופשיה... כשאת נהנית מהמסע... את נמצאת בו לגמרי... כשאת מתפלאת... את מתעוררת	#FFAB91
1367	השוואה מורכבת	כשאת .....את....	תשוקה	כשאת חושבת על זה... את מעוררת... כשאת מרגישה את החשק... את מחזקת אותו... כשאת נותנת לו... את נלקחת	#FFAB91
1368	השוואה מורכבת	כשאת .....את....	תשוקה	כשאת רוצה... את מתלהטת... כשאת לא מתאפקת... את משתחררת... כשאת מרשה... את בוערת	#FFAB91
