ID	Category	Pattern	Theme	Content	Color
744	הפעלת הדימיון	ואת יכולה להרגיש	עונג	ואת יכולה להרגיש איך העונג זורם בוורידים... חם... מתוק... עם כל פעימה של הלב מתפשט יותר... חזק יותר	#CE93D8
745	הפעלת הדימיון	ואת יכולה להרגיש	משחקיות	ואת יכולה להרגיש איך הסקרנות מתחילה לדגדג בך... מעניין... מסקרן... הרצון לגלות... לחקור... לראות מה הלאה	#CE93D8
746	הפעלת הדימיון	ואת יכולה להרגיש	משחקיות	ואת יכולה להרגיש איך הדימוי הופך חי... נושם... זז... כאילו את באמת שם... נוגעת... רואה... חווה	#CE93D8
747	הפעלת הדימיון	ואת יכולה להרגיש	תשוקה	ואת יכולה להרגיש איך החשק מתחיל כניצוץ קטן... ואז גדל... מתלהב... הופך להבה... אש... בוערת בכל תא	#CE93D8
748	הפעלת הדימיון	ואת יכולה להרגיש	תשוקה	ואת יכולה להרגיש איך הגוף מתכונן... מתעורר... כל חלק רוצה... צריך... והרצון גדל... מתעצם... תובע	#CE93D8
749	הפעלת הדימיון	ואת יכולה להרגיש	חופש	ואת יכולה להרגיש איך הכבדות נופלת ממך... וברגע אחד את קלה... כמו נוצה... רק רוח... יכולה לעוף	#CE93D8
750	הפעלת הדימיון	ואת יכולה להרגיש	חופש	ואת יכולה להרגיש איך המרחב מתרחב... הקירות נעלמים... והעולם כולו פתוח... אין גבולות... אין סוף	#CE93D8
751	הפעלת הדימיון	ואת יכולה להרגיש	שובבות	ואת יכולה להרגיש איך הדגדוג הזה מתפשט... מהצוואר לבטן... לכפות הידיים... וזה כל כך משעשע... ממכר	#CE93D8
752	הפעלת הדימיון	ואת יכולה להרגיש	שובבות	ואת יכולה להרגיש איך החיוך עולה מבפנים... מהלב... מתפשט לפנים... לעיניים... והכל נהיה קליל... כיפי	#CE93D8
753	הפעלת הדימיון	ואת יכולה להרגיש	סקסי	ואת יכולה להרגיש איך העור שלך מתעורר... כל מילימטר הופך רגיש... ערני... והנשימה משתנה... עמוקה... חמה	#CE93D8
754	הפעלת הדימיון	ואת יכולה להרגיש	סקסי	ואת יכולה להרגיש איך החושניות זורמת דרכך... בכל תנועה... בכל נשימה... הגוף יודע... רוצה... מבקש	#CE93D8
755	הפעלת הדימיון	ואת יכולה להרגיש	פראיות	ואת יכולה להרגיש איך הדחף הפראי מתעורר עמוק בבטן... פרימיטיבי... חזק... משתלט... לוקח שליטה	#CE93D8
756	הפעלת הדימיון	ואת יכולה להרגיש	פראיות	ואת יכולה להרגיש איך האינסטינקטים מתעוררים... חדים... בטוחים... והגוף פועל... לא חושב... פשוט יודע	#CE93D8
757	הפעלת הדימיון	ואת יכולה להרגיש	שמחה	ואת יכולה להרגיש איך האור מתפשט בחזה... חם... זהוב... מאיר מבפנים... והכל נראה יפה פתאום	#CE93D8
758	הפעלת הדימיון	ואת יכולה להרגיש	שמחה	ואת יכולה להרגיש איך השמחה עולה... בועה... מתפוצצת... והלב פשוט שמח... מלא... חי	#CE93D8
759	הפעלת הדימיון	ואת יכולה להרגיש	בטחון ומוגנות	ואת יכולה להרגיש איך הביטחון שוקע בך... עמוק... מוצק... כמו קרקע איתנה מתחת... תומכת... מחזיקה	#CE93D8
760	הפעלת הדימיון	ואת יכולה להרגיש	בטחון ומוגנות	ואת יכולה להרגיש איך ההגנה מקיפה אותך... חמה... רכה... חזקה... ואת יכולה פשוט לשחרר הכל	#CE93D8
761	הפעלת הדימיון	אני רוצה שתדמייני...	רגיעה	אני רוצה שתדמייני את עצמך צפה על מים שקטים... רק שמיים... אין גבולות... אין קצה... רק שלום מוחלט	#CE93D8
762	הפעלת הדימיון	אני רוצה שתדמייני...	רגיעה	אני רוצה שתדמייני שכל מחשבה מטרידה הופכת לעלה... צף על נחל... וזורם הרחק... הרחק... עד שהראש ריק ושקט	#CE93D8
763	הפעלת הדימיון	אני רוצה שתדמייני...	עונג	אני רוצה שתדמייני שיש קרן אור זהובה חמה... נוגעת בך... מעוררת עונג... וכל מקום שהיא נוגעת בו מתפשט חום נעים	#CE93D8
764	הפעלת הדימיון	אני רוצה שתדמייני...	עונג	אני רוצה שתדמייני שכל תא בגוף הוא כוכב קטן... והם מתחילים לזהור... אחד אחד... עד שכל הגוף זוהר מהנאה	#CE93D8
765	הפעלת הדימיון	אני רוצה שתדמייני...	משחקיות	אני רוצה שתדמייני שאת נכנסת לעולם קסום... צבעים שלא ראית... צורות שמשתנות... והכל אפשרי... הכל מפתיע	#CE93D8
766	הפעלת הדימיון	אני רוצה שתדמייני...	משחקיות	אני רוצה שתדמייני שאת הופכת לכל דבר שאת רוצה... ציפור... דג... רוח... והופכת חזרה... משחקת עם הצורות	#CE93D8
767	הפעלת הדימיון	אני רוצה שתדמייני...	תשוקה	אני רוצה שתדמייני שיש להבה קטנה בבטן... ואיתי היא גדלה... עולה... מתפשטת... עד שכל הגוף בוער מרצון	#CE93D8
768	הפעלת הדימיון	אני רוצה שתדמייני...	תשוקה	אני רוצה שתדמייני שהחשק שלך הוא חיה... רעבה... חזקה... והיא מתחילה להתעורר... להתמתח... לרצות	#CE93D8
769	הפעלת הדימיון	אני רוצה שתדמייני...	חופש	אני רוצה שתדמייני שכל חוט שקשר אותך נשרף... אחד אחד... ופתאום את חופשיה... לגמרי... ללא שום דבר שמחזיק	#CE93D8
770	הפעלת הדימיון	אני רוצה שתדמייני...	חופש	אני רוצה שתדמייני שאת במרחב אינסופי... אין תקרה... אין קירות... רק מרחב... והאפשרויות אינסופיות	#CE93D8
771	הפעלת הדימיון	אני רוצה שתדמייני...	שובבות	אני רוצה שתדמייני שיש נוצות קסומות מדגדגות אותך... בכל מקום... ואת צוחקת... משתעשעת... נהנית	#CE93D8
772	הפעלת הדימיון	אני רוצה שתדמייני...	שובבות	אני רוצה שתדמייני שאת חוזרת לגיל 5... כל כך סקרנית... כל כך חופשיה... משחקת... ושום דבר לא רציני מדי	#CE93D8
773	הפעלת הדימיון	אני רוצה שתדמייני...	סקסי	אני רוצה שתדמייני שהעור שלך הופך לקטיפה רכה... רגישה... וכל נשימת אוויר מגרה... מעוררת... מחממת	#CE93D8
774	הפעלת הדימיון	אני רוצה שתדמייני...	סקסי	אני רוצה שתדמייני שאת עומדת מול מראה... רואה עצמך... ונפעמת מהחושניות... מהיופי... מהעוצמה הנשית	#CE93D8
775	הפעלת הדימיון	אני רוצה שתדמייני...	פראיות	אני רוצה שתדמייני שאת בג'ונגל בלילה... ירח מלא... והחיה שבך מתעוררת... פראית... חזקה... חופשיה	#CE93D8
776	הפעלת הדימיון	אני רוצה שתדמייני...	פראיות	אני רוצה שתדמייני שהשליטה היא כלוב... והדלת נפתחת... והחיה הפראית יוצאת... רצה... חופשיה... בלתי נשלטת	#CE93D8
777	הפעלת הדימיון	אני רוצה שתדמייני...	שמחה	אני רוצה שתדמייני שהלב שלך הוא שמש... והוא מתחיל לזרוח... חם... בהיר... מאיר את כל הגוף מבפנים	#CE93D8
778	הפעלת הדימיון	אני רוצה שתדמייני...	שמחה	אני רוצה שתדמייני שאת בשדה פרחים... צבעים... ריחות... רוח נעימה... והלב פשוט שמח להיות חי	#CE93D8
779	הפעלת הדימיון	אני רוצה שתדמייני...	בטחון ומוגנות	אני רוצה שתדמייני שאת בתוך מגדל חזק... חומות עבות... בטוח... ובפנים יש אש חמה... רך... נעים	#CE93D8
780	הפעלת הדימיון	אני רוצה שתדמייני...	בטחון ומוגנות	אני רוצה שתדמייני שיש לך מלאך שומר... גדול... חזק... כנפיים מסביבך... והוא שומר... מגן... מטפל	#CE93D8
781	הפעלת הדימיון	תעמידי פנים ש..	רגיעה	תעמידי פנים שאת צפה במים חמים... תרגישי איך זה... הכבדות... החום... והגוף שלך באמת מאמין... ונרגע	#CE93D8
782	הפעלת הדימיון	תעמידי פנים ש..	רגיעה	תעמידי פנים שכל הגוף שלך עשוי מעננים רכים... קליל... ממריא... והוא באמת מרגיש קל... כל כך קל	#CE93D8
783	הפעלת הדימיון	תעמידי פנים ש..	עונג	תעמידי פנים שמישהו מעסה לך את הגוף... ידיים חמות... מיומנות... והגוף שלך באמת מגיב... נהנה... מרגיש	#CE93D8
784	הפעלת הדימיון	תעמידי פנים ש..	עונג	תעמידי פנים שעוברת דרכך זרם של חשמל נעים... מכף רגל למעלה... והתחושה באמת שם... מדגדגת... מענגת	#CE93D8
785	הפעלת הדימיון	תעמידי פנים ש..	משחקיות	תעמידי פנים שאת יכולה לעוף... תרימי ידיים... תרגישי את הרוח... והגוף שלך באמת מרגיש קל... מרחף	#CE93D8
786	הפעלת הדימיון	תעמידי פנים ש..	משחקיות	תעמידי פנים שאת קוסמת... יכולה לשנות דברים במחשבה... והדמיון שלך באמת משתלט... יוצר... קורה	#CE93D8
787	הפעלת הדימיון	תעמידי פנים ש..	תשוקה	תעמידי פנים שמישהו שאת רוצה לוחש לך בצוואר... חם... קרוב... והגוף שלך באמת מגיב... מתרגש... רוצה	#CE93D8
788	הפעלת הדימיון	תעמידי פנים ש..	תשוקה	תעמידי פנים שיש אש בבטן... תרגישי את החום... והלהט באמת שם... גדל... מתלהב... בוער	#CE93D8
789	הפעלת הדימיון	תעמידי פנים ש..	חופש	תעמידי פנים שאת יכולה לעבור דרך קירות... אין מחסומים... והתחושה של חופש באמת מתפשטת... מרחיבה	#CE93D8
790	הפעלת הדימיון	תעמידי פנים ש..	חופש	תעמידי פנים שאת ציפור... רחף... גובה... והחופש הזה באמת נכנס לגוף... מרים... משחרר	#CE93D8
791	הפעלת הדימיון	תעמידי פנים ש..	שובבות	תעמידי פנים שמדגדגים לך את הרגליים... תרגישי... והדגדוג באמת שם... משעשע... ממכר	#CE93D8
792	הפעלת הדימיון	תעמידי פנים ש..	שובבות	תעמידי פנים שאת בסרטון מצחיק... צוחקת... והחיוך באמת עולה... הבטן רועדת... כיפי	#CE93D8
793	הפעלת הדימיון	תעמידי פנים ש..	סקסי	תעמידי פנים שמישהו מסתכל עליך במבט רעב... רוצה אותך... והגוף שלך באמת מגיב... מתעורר... חי	#CE93D8
794	הפעלת הדימיון	תעמידי פנים ש..	סקסי	תעמידי פנים שאת רוקדת... חושנית... והחושניות באמת זורמת... בכל תנועה... בכל נשימה	#CE93D8
795	הפעלת הדימיון	תעמידי פנים ש..	פראיות	תעמידי פנים שאת חיה ביער... פראית... חזקה... והדחף הזה באמת מתעורר... אינסטינקטיבי... בלתי נשלט	#CE93D8
796	הפעלת הדימיון	תעמידי פנים ש..	פראיות	תעמידי פנים שאת טורפת... צדה... והכוח הזה באמת שם... בשרירים... בדם... מוכן לפרוץ	#CE93D8
797	הפעלת הדימיון	תעמידי פנים ש..	שמחה	תעמידי פנים שקורה משהו נפלא... הרגע... והשמחה באמת שם... פורצת... מציפה... מאירה	#CE93D8
798	הפעלת הדימיון	תעמידי פנים ש..	שמחה	תעמידי פנים שהשמש זורחת מהלב שלך... חמה... בהירה... והאור באמת שם... זוהר... מתפשט	#CE93D8
799	הפעלת הדימיון	תעמידי פנים ש..	בטחון ומוגנות	תעמידי פנים שמישהו חזק מחבק אותך... מגן... והביטחון באמת שם... חזק... מוצק... מרגיע	#CE93D8
800	הפעלת הדימיון	תעמידי פנים ש..	בטחון ומוגנות	תעמידי פנים שאת בתוך שריון זהוב... מוגנת... והתחושה באמת שם... בטוחה... שלווה	#CE93D8
801	הפעלת הדימיון	וזה כמו...	רגיעה	והתחושה הזו של רגיעה... זה כמו לצלול למים עמוקים... שקטים... קרירים... והכל רחוק... רחוק... למעלה	#CE93D8
802	הפעלת הדימיון	וזה כמו...	רגיעה	והדרך שבה הגוף משתחרר... זה כמו קרח שנמס... לאט... הופך למים... זורם... והכל נעשה רך	#CE93D8
803	הפעלת הדימיון	וזה כמו...	עונג	והעונג הזה שזורם בך... זה כמו דבש זהוב חם... מתוק... נוזל... מתפשט בכל ורד... בכל תא	#CE93D8
804	הפעלת הדימיון	וזה כמו...	עונג	והתחושה הנעימה... זה כמו גלים רכים על החוף... אחד... ועוד אחד... כל גל מביא הנאה... מסיר מתח	#CE93D8
805	הפעלת הדימיון	וזה כמו...	משחקיות	והדימוי הזה... זה כמו להיכנס לספר אגדות... קסום... מלא צבעים... והכל אפשרי... הכל מותר	#CE93D8
806	הפעלת הדימיון	וזה כמו...	משחקיות	והתחושה של סקרנות... זה כמו לפתוח מתנה... ריגוש... ציפייה... והרצון לגלות מה בפנים	#CE93D8
807	הפעלת הדימיון	וזה כמו...	תשוקה	והחשק הזה... זה כמו אש שמתחילה קטנה... ואז גדלה... ועוד... עד שהיא להבה גדולה... בוערת... מלהיבה	#CE93D8
808	הפעלת הדימיון	וזה כמו...	תשוקה	והרצון שעולה... זה כמו רעב... צמא... צורך... והגוף פשוט יודע... דורש... מבקש	#CE93D8
809	הפעלת הדימיון	וזה כמו...	חופש	והתחושה של חופש... זה כמו לפרוש כנפיים... להתרומם... ולעוף... אין משקל... אין גבולות	#CE93D8
810	הפעלת הדימיון	וזה כמו...	חופש	והשחרור הזה... זה כמו כבלים שנשברים... אחד אחד... והיד חופשיה... הרגל חופשיה... הנשמה חופשיה	#CE93D8
811	הפעלת הדימיון	וזה כמו...	שובבות	והדגדוג הזה... זה כמו נוצה קלה... ריחוף... לא יכולה לתפוס... משעשע... ממכר	#CE93D8
812	הפעלת הדימיון	וזה כמו...	שובבות	והתחושה השובבת... זה כמו בועות סבון... עפות... קופצות... צבעוניות... מאירות... כיפיות	#CE93D8
813	הפעלת הדימיון	וזה כמו...	סקסי	והחושניות הזו... זה כמו משי על העור... רך... חלק... מגרה... מעורר כל שערה	#CE93D8
814	הפעלת הדימיון	וזה כמו...	סקסי	והעוררות... זה כמו חשמל... רץ בעור... מדגדג... מעורר... והגוף רוצה עוד	#CE93D8
815	הפעלת הדימיון	וזה כמו...	פראיות	והדחף הפראי... זה כמו סערה... חזקה... בלתי נשלטת... סוחפת... והיא לוקחת אותך	#CE93D8
816	הפעלת הדימיון	וזה כמו...	פראיות	והכוח הזה... זה כמו נמר... חזק... מהיר... יפה... והוא יוצא לצוד... בטוח... אינסטינקטיבי	#CE93D8
817	הפעלת הדימיון	וזה כמו...	שמחה	והשמחה הזו... זה כמו שמש זורחת... חמה... בהירה... מאירה הכל... והכל יפה פתאום	#CE93D8
818	הפעלת הדימיון	וזה כמו...	שמחה	והאושר... זה כמו פרחים שפורחים בלב... צבעוניים... ריח... והם מתפשטים... ממלאים את החזה	#CE93D8
819	הפעלת הדימיון	וזה כמו...	בטחון ומוגנות	והביטחון הזה... זה כמו סלע... איתן... חזק... והוא תומך... מחזיק... לא זזה	#CE93D8
820	הפעלת הדימיון	וזה כמו...	בטחון ומוגנות	וההגנה... זה כמו שמיכה חמה... רכה... מקיפה... והיא שומרת... מגינה... מנחמת	#CE93D8
821	הפעלת הדימיון	תתארי לך...	רגיעה	תתארי לך שאת במקום השקט ביותר בעולם... רק את... רק שקט... אין קולות... אין הפרעות... רק שלום מוחלט	#CE93D8
822	הפעלת הדימיון	תתארי לך...	רגיעה	תתארי לך שכל דאגה שיש לך הופכת לבועה... ועולה... ועולה... ומתפוצצת באוויר... והראש נשאר ריק... שקט	#CE93D8
823	הפעלת הדימיון	תתארי לך...	עונג	תתארי לך שיש לך כוח על כל תא בגוף... ואת מחליטה... עכשיו... כולם מרגישים עונג... והם מציתים... זוהרים... מרגישים	#CE93D8
824	הפעלת הדימיון	תתארי לך...	עונג	תתארי לך שאת במעין חם... מינרלים... פועם... וכל הגוף ספוג בתחושה נעימה... מרפה... נהנה	#CE93D8
825	הפעלת הדימיון	תתארי לך...	משחקיות	תתארי לך שהעולם הוא מגרש משחקים ענק... מלא הפתעות... צבעים... משחקים... ואת יכולה לעשות הכל	#CE93D8
826	הפעלת הדימיון	תתארי לך...	משחקיות	תתארי לך שאת מדענית... מגלה עולמות חדשים... כל דבר מרגש... והסקרנות לוקחת אותך הלאה... והלאה	#CE93D8
827	הפעלת הדימיון	תתארי לך...	תשוקה	תתארי לך שמישהו שאת רוצה יותר מכל דבר... כאן... ממש קרוב... והגוף שלך מתעורר... רוצה... דורש	#CE93D8
828	הפעלת הדימיון	תתארי לך...	תשוקה	תתארי לך שיש בך וולקן... רדום... ופתאום הוא מתעורר... רועם... והלבה עולה... חמה... אדומה... בוערת	#CE93D8
829	הפעלת הדימיון	תתארי לך...	חופש	תתארי לך שאין שום חוקים... שום כללים... את יכולה לעשות כל דבר... להיות כל דבר... ללא פחד... ללא שיפוט	#CE93D8
830	הפעלת הדימיון	תתארי לך...	חופש	תתארי לך שאת נשר... גבוה בשמיים... רואה הכל מלמעלה... חופשיה... עוצמתית... ריבונית	#CE93D8
831	הפעלת הדימיון	תתארי לך...	שובבות	תתארי לך שיש לך כפתור להפוך כל דבר לצחוק... ואת לוחצת... והכל הופך מצחיק... קליל... כיפי	#CE93D8
832	הפעלת הדימיון	תתארי לך...	שובבות	תתארי לך שאת חוזרת לגן... משחקים בחול... בבועות... וזה כל כך כיף... כל כך פשוט	#CE93D8
833	הפעלת הדימיון	תתארי לך...	סקסי	תתארי לך שאת בחדר מלא מראות... רואה את עצמך מכל זווית... יפה... חושנית... עוצמתית... ואת נהנית מזה	#CE93D8
834	הפעלת הדימיון	תתארי לך...	סקסי	תתארי לך שיש לך קול שמעורר כל מי ששומע... והגוף שלך יודע את זה... מרגיש את הכוח... את החושניות	#CE93D8
835	הפעלת הדימיון	תתארי לך...	פראיות	תתארי לך שאת זאבה... בליל ירח מלא... והיללה שלך מהדהדת... פראית... חופשיה... עוצמתית	#CE93D8
836	הפעלת הדימיון	תתארי לך...	פראיות	תתארי לך שאת בטבע הפראי... בלי בגדים... בלי חוקים... רק את והטבע... והאינסטינקטים מובילים	#CE93D8
837	הפעלת הדימיון	תתארי לך...	שמחה	תתארי לך שקורה הדבר הכי טוב בעולם... עכשיו... והלב שלך מתפוצץ משמחה... זוהר... קורן... חי	#CE93D8
838	הפעלת הדימיון	תתארי לך...	שמחה	תתארי לך שאת אהבה טהורה... אור טהור... והכל סביבך מתמלא באור הזה... חם... יפה... מושלם	#CE93D8
839	הפעלת הדימיון	תתארי לך...	בטחון ומוגנות	תתארי לך שיש לך שומר אישי... חזק... אוהב... והוא תמיד כאן... שומר... מגן... מטפל	#CE93D8
840	הפעלת הדימיון	תתארי לך...	בטחון ומוגנות	תתארי לך שאת בארמון... חזק... מוגן... ובפנים חם... נעים... ואין שום דבר שיכול להגיע אליך	#CE93D8
841	הפעלת הדימיון	כמה מה זה מרגיש?...	רגיעה	כמה מה זה מרגיש... השקט הזה שמתפשט... כמו גלים... גל אחרי גל... כל אחד לוקח אותך עמוק יותר למטה	#CE93D8
842	הפעלת הדימיון	כמה מה זה מרגיש?...	רגיעה	כמה מה זה מרגיש... כשהמחשבות פשוט נעלמות... והראש ריק... רק שלווה... רק רוגע... רק שקט מוחלט	#CE93D8
843	הפעלת הדימיון	כמה מה זה מרגיש?...	עונג	כמה מה זה מרגיש... העונג הזה שזורם... כמו דבש חם... נוזל... מתוק... ממלא כל חלל... כל פינה	#CE93D8
844	הפעלת הדימיון	כמה מה זה מרגיש?...	עונג	כמה מה זה מרגיש... כשכל העצבים מתעוררים... זוהרים... והגוף כולו מלא בתחושה נעימה... חיה... פועמת	#CE93D8
845	הפעלת הדימיון	כמה מה זה מרגיש?...	משחקיות	כמה מה זה מרגיש... הסקרנות הזו שמושכת אותך... מעניין... מרתק... והרצון לגלות... לחקור... לדעת	#CE93D8
846	הפעלת הדימיון	כמה מה זה מרגיש?...	משחקיות	כמה מה זה מרגיש... להיות בעולם שבו הכל אפשרי... קסמים... פלאים... והדמיון שולט... יוצר... מפליא	#CE93D8
847	הפעלת הדימיון	כמה מה זה מרגיש?...	תשוקה	כמה מה זה מרגיש... החשק הזה שגדל... מתעצם... לוקח אותך... והרצון הזה כל כך חזק... תובע... דורש	#CE93D8
848	הפעלת הדימיון	כמה מה זה מרגיש?...	תשוקה	כמה מה זה מרגיש... כשהלהט בוער... אש... חום... והגוף רוצה... צריך... מתפוצץ מרצון	#CE93D8
849	הפעלת הדימיון	כמה מה זה מרגיש?...	חופש	כמה מה זה מרגיש... החופש הזה... כשאין שום דבר שמעכב... שמגביל... רק אפשרויות... רק שמיים פתוחים	#CE93D8
850	הפעלת הדימיון	כמה מה זה מרגיש?...	חופש	כמה מה זה מרגיש... כשהכנפיים נפרשות... ואת עפה... קלה... חופשיה... והעולם למטה... קטן	#CE93D8
851	הפעלת הדימיון	כמה מה זה מרגיש?...	שובבות	כמה מה זה מרגיש... הדגדוג הזה... משעשע... ממכר... ואת לא יכולה להפסיק לחייך... זה כל כך כיפי	#CE93D8
852	הפעלת הדימיון	כמה מה זה מרגיש?...	שובבות	כמה מה זה מרגיש... הקלילות הזו... כאילו את ילדה שוב... משחקת... צוחקת... ושום דבר לא כבד מדי	#CE93D8
853	הפעלת הדימיון	כמה מה זה מרגיש?...	סקסי	כמה מה זה מרגיש... החושניות הזו... כשהעור רגיש... הנשימה עמוקה... והגוף יודע מה הוא רוצה	#CE93D8
854	הפעלת הדימיון	כמה מה זה מרגיש?...	סקסי	כמה מה זה מרגיש... כשאת מודעת לכל סנטימטר... חיה... חושנית... נשית... עוצמתית	#CE93D8
855	הפעלת הדימיון	כמה מה זה מרגיש?...	פראיות	כמה מה זה מרגיש... הדחף הזה... פראי... אינסטינקטיבי... כשהשליטה נעלמת... והחיה בך תופסת שליטה	#CE93D8
